{
  "schema_version": 2,
  "browser_compat_data": {
    "name": "@mdn/browser-compat-data",
    "version": "8.1.5",
    "url": "https://unpkg.com/@mdn/browser-compat-data@8.1.5/data.json"
  },
  "web_features": {
    "name": "web-features",
    "version": "3.42.0",
    "url": "https://unpkg.com/web-features@3.42.0/data.json"
  },
  "unmodeled_features": [
    {
      "compat_key": "svg.elements.a.xlink_href",
      "kind": "legacy_xlink_alias",
      "element": "a",
      "name": "xlink_href",
      "mdn_url": "https://developer.mozilla.org/docs/Web/SVG/Reference/Attribute/xlink:href",
      "deprecated": true,
      "standard_track": true,
      "baseline": {
        "support": {
          "chrome": "1",
          "chrome_android": "18",
          "edge": "12",
          "firefox": "1.5",
          "firefox_android": "4",
          "safari": "3.1",
          "safari_ios": "2"
        },
        "status": "limited",
        "raw_status": "false"
      },
      "discouraged": [
        {
          "feature_id": "svg-discouraged",
          "compat_key": "svg.elements.a.xlink_href",
          "scope": "feature",
          "feature_name": "SVG 1.1",
          "reason": "SVG 2 omittted some parts of SVG 1.1 to \"improv[e] the usability and precision of the language.\"",
          "reason_html": "SVG 2 omittted some parts of SVG 1.1 to \"improv[e] the usability and precision of the language.\"",
          "according_to": [
            "https://w3c.github.io/svgwg/svg2-draft/changes.html#substantial"
          ],
          "alternatives": [
            "svg",
            "font-face"
          ]
        }
      ],
      "browser_support": {
        "chrome": [
          {
            "version_added": "1",
            "flags": [],
            "impl_url": [],
            "partial_implementation": false,
            "notes": []
          }
        ],
        "chrome_android": [
          {
            "version_added": "18",
            "flags": [],
            "impl_url": [],
            "partial_implementation": false,
            "notes": []
          }
        ],
        "edge": [
          {
            "version_added": "12",
            "flags": [],
            "impl_url": [],
            "partial_implementation": false,
            "notes": []
          }
        ],
        "firefox": [
          {
            "version_added": "1.5",
            "flags": [],
            "impl_url": [],
            "partial_implementation": false,
            "notes": []
          }
        ],
        "firefox_android": [
          {
            "version_added": "4",
            "flags": [],
            "impl_url": [],
            "partial_implementation": false,
            "notes": []
          }
        ],
        "ie": [
          {
            "version_added": "9",
            "flags": [],
            "impl_url": [],
            "partial_implementation": false,
            "notes": []
          }
        ],
        "oculus": [
          {
            "version_added": "5.0",
            "flags": [],
            "impl_url": [],
            "partial_implementation": false,
            "notes": []
          }
        ],
        "opera": [
          {
            "version_added": "9",
            "flags": [],
            "impl_url": [],
            "partial_implementation": false,
            "notes": []
          }
        ],
        "opera_android": [
          {
            "version_added": "14",
            "flags": [],
            "impl_url": [],
            "partial_implementation": false,
            "notes": []
          }
        ],
        "safari": [
          {
            "version_added": "3.1",
            "flags": [],
            "impl_url": [],
            "partial_implementation": false,
            "notes": []
          }
        ],
        "safari_ios": [
          {
            "version_added": "2",
            "flags": [],
            "impl_url": [],
            "partial_implementation": false,
            "notes": []
          }
        ],
        "samsunginternet_android": [
          {
            "version_added": "1.0",
            "flags": [],
            "impl_url": [],
            "partial_implementation": false,
            "notes": []
          }
        ],
        "webview_android": [
          {
            "version_added": "3",
            "flags": [],
            "impl_url": [],
            "partial_implementation": false,
            "notes": []
          }
        ],
        "webview_ios": [
          {
            "version_added": "2",
            "flags": [],
            "impl_url": [],
            "partial_implementation": false,
            "notes": []
          }
        ]
      }
    },
    {
      "compat_key": "svg.elements.feImage.xlink_href",
      "kind": "legacy_xlink_alias",
      "element": "feImage",
      "name": "xlink_href",
      "deprecated": true,
      "standard_track": true,
      "baseline": {
        "support": {
          "chrome": "5",
          "chrome_android": "18",
          "edge": "12",
          "firefox": "4",
          "firefox_android": "4",
          "safari": "6",
          "safari_ios": "6"
        },
        "status": "limited",
        "raw_status": "false"
      },
      "discouraged": [
        {
          "feature_id": "svg-discouraged",
          "compat_key": "svg.elements.feImage.xlink_href",
          "scope": "feature",
          "feature_name": "SVG 1.1",
          "reason": "SVG 2 omittted some parts of SVG 1.1 to \"improv[e] the usability and precision of the language.\"",
          "reason_html": "SVG 2 omittted some parts of SVG 1.1 to \"improv[e] the usability and precision of the language.\"",
          "according_to": [
            "https://w3c.github.io/svgwg/svg2-draft/changes.html#substantial"
          ],
          "alternatives": [
            "svg",
            "font-face"
          ]
        }
      ],
      "browser_support": {
        "chrome": [
          {
            "version_added": "5",
            "flags": [],
            "impl_url": [],
            "partial_implementation": false,
            "notes": []
          }
        ],
        "chrome_android": [
          {
            "version_added": "18",
            "flags": [],
            "impl_url": [],
            "partial_implementation": false,
            "notes": []
          }
        ],
        "edge": [
          {
            "version_added": "12",
            "flags": [],
            "impl_url": [],
            "partial_implementation": false,
            "notes": []
          }
        ],
        "firefox": [
          {
            "version_added": "4",
            "flags": [],
            "impl_url": [],
            "partial_implementation": false,
            "notes": [
              "Document fragments (including references to fragments in the current document) are not supported (see <a href=\"https://bugzil.la/455986\">bug 455986</a>)."
            ]
          }
        ],
        "firefox_android": [
          {
            "version_added": "4",
            "flags": [],
            "impl_url": [],
            "partial_implementation": false,
            "notes": [
              "Document fragments (including references to fragments in the current document) are not supported (see <a href=\"https://bugzil.la/455986\">bug 455986</a>)."
            ]
          }
        ],
        "ie": [
          {
            "version_added": "≤11",
            "flags": [],
            "impl_url": [],
            "partial_implementation": false,
            "notes": []
          }
        ],
        "oculus": [
          {
            "version_added": "5.0",
            "flags": [],
            "impl_url": [],
            "partial_implementation": false,
            "notes": []
          }
        ],
        "opera": [
          {
            "version_added": "9",
            "flags": [],
            "impl_url": [],
            "partial_implementation": false,
            "notes": []
          }
        ],
        "opera_android": [
          {
            "version_added": "14",
            "flags": [],
            "impl_url": [],
            "partial_implementation": false,
            "notes": []
          }
        ],
        "safari": [
          {
            "version_added": "6",
            "flags": [],
            "impl_url": [],
            "partial_implementation": false,
            "notes": []
          }
        ],
        "safari_ios": [
          {
            "version_added": "6",
            "flags": [],
            "impl_url": [],
            "partial_implementation": false,
            "notes": []
          }
        ],
        "samsunginternet_android": [
          {
            "version_added": "1.0",
            "flags": [],
            "impl_url": [],
            "partial_implementation": false,
            "notes": []
          }
        ],
        "webview_android": [
          {
            "version_added": "4.4",
            "flags": [],
            "impl_url": [],
            "partial_implementation": false,
            "notes": []
          }
        ],
        "webview_ios": [
          {
            "version_added": "6",
            "flags": [],
            "impl_url": [],
            "partial_implementation": false,
            "notes": []
          }
        ]
      }
    },
    {
      "compat_key": "svg.elements.filter.xlink_href",
      "kind": "legacy_xlink_alias",
      "element": "filter",
      "name": "xlink_href",
      "mdn_url": "https://developer.mozilla.org/docs/Web/SVG/Reference/Attribute/xlink:href",
      "deprecated": true,
      "standard_track": true,
      "baseline": {
        "support": {
          "chrome": "5",
          "chrome_android": "18",
          "edge": "79",
          "firefox": "3",
          "firefox_android": "4",
          "safari": "6",
          "safari_ios": "6"
        },
        "status": "limited",
        "raw_status": "false"
      },
      "discouraged": [
        {